{
  "schema_version": 1,
  "resource_kind": "court",
  "resource_id": "ca4r54b.court.ca4",
  "jurisdiction_id": "us.ca4",
  "name": "United States Court of Appeals for the Fourth Circuit",
  "court_role": "appellate",
  "authority_set_ids": ["ca4r54b.authorities.2026-08-11"],
  "holidays": [
    "2026-01-01",
    "2026-01-19",
    "2026-02-16",
    "2026-05-25",
    "2026-06-19",
    "2026-07-03",
    "2026-09-07",
    "2026-10-12",
    "2026-11-11",
    "2026-11-26",
    "2026-12-25"
  ]
}
